{
  "fetched_at": "2026-10-13T12:00:00Z",
  "repo": "rxm7706/local-recipes",
  "rate_limit": {
    "core_limit": 5000,
    "core_remaining": 4999
  },
  "rows": [
    {
      "id": "overdue.pause",
      "switch": "PAUSE_OVERDUE",
      "declared_state": "paused",
      "live_switch_value": "true",
      "paused_since": "2026-10-01",
      "review_by": "2026-10-01",
      "review_days_left": -5,
      "owner": "pyforge-steward",
      "last_green_run": "2026-10-01T00:00:00Z",
      "verdict": "overdue"
    }
  ]
}
