{
  "fetched_at": "2026-10-13T12:00:00Z",
  "repo": "rxm7706/local-recipes",
  "rate_limit": {
    "core_limit": 5000,
    "core_remaining": 4999
  },
  "rows": [
    {
      "id": "unregistered:PAUSE_FOO",
      "switch": "PAUSE_FOO",
      "declared_state": "\u2014",
      "live_switch_value": "true",
      "paused_since": null,
      "review_by": null,
      "review_days_left": null,
      "owner": null,
      "last_green_run": null,
      "verdict": "drift",
      "detail": "repository variable PAUSE_FOO is not declared in the CI surface registry"
    }
  ]
}
